{"schema_version":"1.0","acquisition_id":"official-mnq-202609-5m-inventory-20260622-20260724-v2","cohort_id":"mnq-202609-5m-v1","instrument":{"contract_label":"MNQ SEP26","full_name":"MNQ SEP26","master_name":"MNQ","expiry_month":9,"expiry_year":2026},"ninjatrader_version":"8.1.8.3","scanner_identity":{"name":"ScanMnq5mSourceInventory","scanner_sha256":null,"scanner_sha256_recording_authority":"operator/finalizer"},"bar_series":{"type":"Minute","value":5,"native":true,"calculate":"OnBarClose"},"trading_hours":{"name":"CME US Index Futures ETH","timezone_id":"Central Standard Time"},"application_timezone":{"id":"Singapore Standard Time","display_name":"(UTC+08:00) 吉隆坡，新加坡","standard_name":"马来西亚半岛标准时间","daylight_name":"马来西亚半岛夏令时","base_utc_offset":"+08:00","supports_dst":false},"pc_timezone":{"id":"Singapore Standard Time","display_name":"(UTC+08:00) 吉隆坡，新加坡","standard_name":"马来西亚半岛标准时间","daylight_name":"马来西亚半岛夏令时","base_utc_offset":"+08:00","supports_dst":false},"active_connections":[{"name":"My NinjaTrader","provider":"Provider31","status":"Connected","price_status":"Connected","instrument_types":["Future","CryptoCurrency","Index","Option","Stock"]}],"connection_snapshot_phase":"immediately after operator arm and before inventory scan","lifecycle":{"initialized_at":"2026-10-05T22:43:06.8612774+08:00","realtime_observed_at":"2026-10-05T22:43:06.8612774+08:00","armed_at":"2026-10-05T22:53:32.2686218+08:00","completed_at":"2026-10-05T22:53:32.3885629+08:00"},"artifact_hashes":{"inventory_scan":{"file_name":"inventory_scan.json","sha256":"f82384171a804c925bc73aab91abeb608dbc7608e44ec09aa701e4fdb8cb422f"},"inventory_runtime_capture":{"file_name":"inventory_runtime_capture.json","sha256":null,"sha256_recording_authority":"operator/finalizer"},"trading_hours_template":{"file_name":"trading_hours_template.xml","sha256":"370b17f23eeea694e686394b5fdb9b55681089c22d5232d5e6a354a314325620"},"ninjatrader_config":{"file_name":"NinjaTrader.Config.xml","sha256":"6e87c502ea9d5972f7c4aea51fe73264299551abcb0148261fd73696c56e8865"}}}
